{"schema_id":"urn:serenity:schema:method-claim-synthesis:1","format":"serenity-method-claim-synthesis/1","candidate_digest_content_hash":"3056087bca1f24c5ee660bfce20a47bfdc93961f7b8e1f090efdd8949632d6f3","candidate_digest_sha256":"a2dd0883ae5aa804d7346ee2695b5be58da463a74ce5a1851e8f71ac0f495cb7","claims":[{"claim_id":"claim-01-screen-price-and-positioning-before-inference","claim":"When an abnormal price move appears, seek company disclosures, news, volume, and peer or sector moves before treating it as durable repricing; act on the catalyst review the same day, and reject the repricing interpretation if no incremental information or abnormal trading activity exists. Likewise, treat unusually high short interest as nondirectional positioning risk: verify float percentage, days to cover, borrow cost, utilization, liquidity, and catalysts over days to weeks, with falling short interest without price pressure or disproof of the bearish concerns as falsifiers.","provenance_tag":"sourced","shown_unit_refs":["unit-459bb224a39890493eef","unit-25eb989ba2cd0336ec95"],"shown_code_refs":[{"axis":"observation_type","label":"abnormal price move"},{"axis":"observation_type","label":"Short-interest positioning"}],"counterexample_refs":[],"counterexample_search_scope":"candidate-digest.json bounded_summary.counterexample_refs.entries","counterexample_status":"none_found","why":"The shown observations consistently make conspicuous market data a research trigger rather than a directional conclusion and attach evidence requirements, action horizons, and explicit falsifiers.","uncertainty_notes":["The denominator and days-to-cover measure are not shown."],"contradiction_notes":["High short interest alone does not establish either a squeeze or a short case."]},{"claim_id":"claim-02-validate-every-causal-hop","claim":"When a downstream bottleneck or labor shift is linked to an investment beneficiary, validate every causal hop before acting: for a supply chain, test material intensity, supplier share, inventories, qualification cycles, alternatives, and whether the proposed input is actually binding during the demand ramp; for automation, distinguish structural substitution from cyclical weakness using employment, implementation, productivity, wage, and margin evidence over multiple years. Abandon the respective inference if another component is the real constraint, or if cyclical explanations dominate, automation is not implemented, or margin expansion fails to appear.","provenance_tag":"sourced","shown_unit_refs":["unit-4bb4105403dd3ec87944","unit-098e4275703e03ec97a3"],"shown_code_refs":[{"axis":"causal_hop","label":"Upstream bottleneck mapping"},{"axis":"causal_hop","label":"Automation to margin expansion"}],"counterexample_refs":[],"counterexample_search_scope":"candidate-digest.json bounded_summary.counterexample_refs.entries","counterexample_status":"none_found","why":"Both shown causal-hop units require evidence that the proposed intermediary mechanism is binding rather than accepting a plausible thematic narrative as causation.","uncertainty_notes":["The assertion that one small supplier bottlenecks the entire buildout is unverified.","The attribution of the payroll revision to AI is asserted without causal evidence."],"contradiction_notes":[]},{"claim_id":"claim-03-verify-identity-and-revenue-linkage","claim":"When an enabling component or new platform suggests cross-sector or multi-tier supplier exposure, trace supplier-to-customer relationships, compatibility, qualification, vendor share, bill-of-materials content, adoption commitments, substitutability, and end-market demand before assigning optionality or initiating exposure. Over the medium term to two years, prefer links where platform volume has the clearest and least commoditized revenue connection; falsify the mapping if qualification is absent, adoption stalls, vendor share changes, or substitution occurs.","provenance_tag":"sourced","shown_unit_refs":["unit-c048ea34360d3b980e5e","unit-28f74f31a271e13a808d"],"shown_code_refs":[{"axis":"identity_provenance","label":"Supply-chain mapping"},{"axis":"identity_provenance","label":"Supplier-role verification"}],"counterexample_refs":[],"counterexample_search_scope":"candidate-digest.json bounded_summary.counterexample_refs.entries","counterexample_status":"none_found","why":"The shown identity-provenance units make verified commercial identity and revenue linkage prerequisites for translating thematic overlap into investable exposure.","uncertainty_notes":["The central supplier mapping is explicitly described as highly possible rather than confirmed.","Several supplier relationships are explicitly speculative."],"contradiction_notes":[]},{"claim_id":"claim-04-separate-asset-value-from-realizability","claim":"When a company appears to trade below the value of a separately valued stake, calculate adjusted net asset value using ownership, realizability, liabilities, tax leakage, governance constraints, and operating-business economics, then monitor credible monetization, sale, or listing catalysts. Infer asymmetric value only conditionally; reject it if the stake is illiquid, encumbered, overvalued, or unmonetizable, or if the operating business deteriorates.","provenance_tag":"sourced","shown_unit_refs":["unit-9faf14fa861011d4cc88"],"shown_code_refs":[{"axis":"value_capture","label":"Holding-company NAV discount"}],"counterexample_refs":[],"counterexample_search_scope":"candidate-digest.json bounded_summary.counterexample_refs.entries","counterexample_status":"none_found","why":"The shown value-capture unit distinguishes quoted stake value from realizable parent-level value and ties action to a concrete recognition mechanism.","uncertainty_notes":["The text does not establish net debt, tax leakage, governance constraints, or the realizable value of the stake."],"contradiction_notes":[]},{"claim_id":"claim-05-match-derivative-hurdle-to-thesis-window","claim":"When an option chain displays breakevens far above the underlying price, interpret the displayed upside primarily as a premium hurdle rather than a probability-weighted forecast. Before entry and throughout the holding period, compare premiums, open interest, liquidity, implied volatility, strikes, and expiries, and select only liquid contracts whose expiry accommodates the catalyst window; falsify the claim of an unusually demanding hurdle if a liquid chain offers modest premiums and thesis-consistent breakevens.","provenance_tag":"sourced","shown_unit_refs":["unit-2d5abd36d86b6d4ff557"],"shown_code_refs":[{"axis":"value_capture","label":"Option breakeven hurdle"},{"axis":"timing_entry","label":"Expiry-thesis matching"}],"counterexample_refs":[],"counterexample_search_scope":"candidate-digest.json bounded_summary.counterexample_refs.entries","counterexample_status":"none_found","why":"The same shown unit is canonically coded on both value capture and timing, supporting an interface that joins required underlying movement, contract pricing, liquidity, and thesis duration.","uncertainty_notes":["The screenshot does not show premiums, volume, or open interest for each contract."],"contradiction_notes":[]},{"claim_id":"claim-06-test-catalyst-conversion-capacity","claim":"When policy restricts a competitor or a contract appears to rerate a supplier, test whether the apparent catalyst can convert into usable economics. For a supply restriction, verify its scope, displaced capacity, substitutes, customer qualification, and the beneficiary's usable capacity immediately after implementation; the pricing-power inference fails if competitors retain access or customers qualify alternatives. For a contract, validate value, duration, revenue recognition, margins, financing needs, execution capacity, valuation, and price reaction over months to years before treating backlog as captured value.","provenance_tag":"sourced","shown_unit_refs":["unit-efd16a1b7332374c8079","unit-7fe711586f1547425a4c"],"shown_code_refs":[{"axis":"catalyst_mechanism","label":"Export-control supply shock"},{"axis":"catalyst_mechanism","label":"Contract-driven rerating"}],"counterexample_refs":[],"counterexample_search_scope":"candidate-digest.json bounded_summary.counterexample_refs.entries","counterexample_status":"none_found","why":"The shown catalyst units require both demand transfer and operational or financial conversion, preventing a headline event from being equated with realized value.","uncertainty_notes":["The post does not substantiate the claimed monopoly."],"contradiction_notes":[]},{"claim_id":"claim-07-evaluate-capital-by-per-share-conversion","claim":"When external financing or public support accompanies expansion, evaluate the full conversion from capital to per-share operating value. For an active at-the-market program, track remaining capacity, share count, use of proceeds, and completion, deferring exposure while dilution impairs per-share value unless the funded activity produces greater accretion. For conditional public funding, monitor award finalization, conditions, capex timing, usable capacity, and customer demand over the medium to long term; reject the catalyst if funding is withdrawn or reduced, or fails to create incremental usable capacity.","provenance_tag":"sourced","shown_unit_refs":["unit-44ff8799a0383b38aca3","unit-fe2efe2268a657e249a8"],"shown_code_refs":[{"axis":"funding_capital_structure","label":"ATM dilution overhang"},{"axis":"funding_capital_structure","label":"Conditional public-capex support"}],"counterexample_refs":[],"counterexample_search_scope":"candidate-digest.json bounded_summary.counterexample_refs.entries","counterexample_status":"none_found","why":"The shown capital-structure units separate gross enterprise expansion from per-share accretion and completed operating capacity.","uncertainty_notes":["The stated program size and peer comparison are unverified.","Some facility-description text is OCR-distorted."],"contradiction_notes":[]},{"claim_id":"clai